{
  "name": "Dubai Marina",
  "developer": "LIV Developers",
  "last_updated": "2026-05-30",
  "researcher_notes": [
    "LIV Residence is a completed G+27 tower in Dubai Marina by LIV Real Estate Development (also known as LIV Developers). It is ready to move in per Tanami Properties listing.",
    "LIV Residence construction began September 2016; original handover target was July 2019 per Propsearch. Current listings confirm it is ready/completed.",
    "Dubai Marina DLD area code is 'Marsa Dubai'. ROI data from uaecalc.com is sourced from DLD open data.",
    "Gross rental yield figures vary by source: uaecalc.com (DLD-based) shows 5.1% average for apartments; valorisimo.com cites 5.8–7.2%; astraterra.ae cites 7.1% long-term and 8.5–12% short-term. All figures are gross and pre-fees.",
    "LIV Developers also known as LIV Real Estate Development. Sources use both 'LIV Developers' and 'LIV Real Estate' interchangeably.",
    "Closest metro stations to Dubai Marina: DMCC (R37) and Sobha Realty (R36) on the Red Line. Dubai Tram also serves the area directly.",
    "Closest school cited by Luxhabitat: Wellington International School. Closest hospital: Emirates Hospital. Exact distances not confirmed by sources.",
    "Dubai Marina is freehold, making it eligible for UAE Golden Visa for purchases AED 2M+.",
    "Average selling prices as of December 2025 per Property Monitor via Engel & Voelkers: Studio AED 1.38M, 1BR AED 1.88M, 2BR AED 2.70M, 3BR AED 4.49M, 4BR AED 10.68M.",
    "LIV Residence unit sizes: 1,243 to 2,224 sq ft per Tanami; Luxhabitat states from 505 sq ft (likely includes studios). Starting price cited as AED 849,548–859,548 across sources.",
    "Short-term rental in Dubai Marina requires a DTCM Holiday Home Permit; fines from AED 5,000 for unlicensed operations.",
    "Dubai Marina ranked #3 by apartment transaction volume citywide in Q4 2025 per DLD data cited by Astraterra."
  ],
  "master_development": {
    "overview": {
      "name": "Dubai Marina",
      "type": "Master-planned waterfront residential and mixed-use community",
      "description": "Dubai Marina is the world's largest man-made marina, stretching approximately 3.5 km with 11 km of marine frontage along the Persian Gulf shoreline. It comprises over 200 residential towers, a 7 km Marina Walk promenade, and a vibrant mix of dining, retail, hotels, and leisure. The community covers approximately 50 million sq ft and accommodates an estimated 55,000 residents, with capacity for up to 120,000 when fully built out.",
      "total_towers": "200+",
      "area_sqft": "50 million sq ft (approx)",
      "canal_length_km": "3.5 km marina, 11 km marine frontage",
      "status": "Established/operational community with select off-plan projects ongoing",
      "dld_area_name": "Marsa Dubai"
    },
    "location_connectivity": {
      "emirate": "Dubai",
      "district": "New Dubai / Sheikh Zayed Road corridor",
      "metro": {
        "nearest_stations": [
          "DMCC Metro Station (Red Line, R37) – serves Dubai Marina and JLT",
          "Sobha Realty Metro Station (Red Line, R36)"
        ],
        "line": "Red Line",
        "notes": "Red Line connects to Dubai Mall/Burj Khalifa, Mall of the Emirates, Dubai Internet City, and Dubai International Airport"
      },
      "tram": {
        "available": true,
        "station": "Dubai Marina Tram Station",
        "notes": "Dubai Tram runs through the community and connects to the metro at DMCC and Sobha Realty stations"
      },
      "water_taxi": {
        "available": true,
        "notes": "Dubai Water Taxi accessible from the marina"
      },
      "road": {
        "primary": "Sheikh Zayed Road (E11)",
        "notes": "Direct access to Sheikh Zayed Road; connects to all major Dubai business and leisure districts"
      },
      "drive_times_approximate": {
        "dubai_mall": "~19 minutes",
        "palm_jumeirah": "~11 minutes",
        "burj_al_arab": "~17 minutes",
        "the_walk_jbr": "~8 minutes",
        "dubai_international_airport_dxb": "~26–27 minutes",
        "al_maktoum_international_airport": "~36 minutes",
        "disclaimer": "Drive times are approximate and sourced from Propsearch and Luxhabitat; actual times vary with traffic"
      }
    },
    "shared_amenities": {
      "promenade": "7 km Marina Walk – pedestrian and cycling path lined with cafes, restaurants, and retail",
      "retail": [
        "Dubai Marina Mall (includes Waitrose hypermarket and Reel Cinemas)",
        "Promenade-level retail in multiple towers",
        "The Beach at JBR (adjacent)"
      ],
      "dining_and_nightlife": [
        "Pier 7 – seven-floor dining destination",
        "Cafe Bateel, Starbucks, Costa Coffee on Marina Walk",
        "Numerous waterfront restaurants and late-night lounges",
        "The Address Dubai Marina – 5-star hotel with rooftop Shades lounge"
      ],
      "hotels": [
        "The Address Dubai Marina (5-star)",
        "Grosvenor House",
        "Ritz-Carlton Dubai Marina",
        "Stella Di Mare"
      ],
      "leisure_and_recreation": [
        "Dubai Marina Yacht Club",
        "JBR Beach (adjacent, minutes away)",
        "Bluewaters Island (connected via promenade)",
        "XLine Dubai – urban zipline",
        "Outdoor gyms along Marina Walk",
        "Multiple fitness studios and spas including Fitness First"
      ],
      "parks_and_green_spaces": "Small parks and playgrounds within the community",
      "transport_hubs": "Metro, Tram, Water Taxi, and abundant taxis"
    },
    "nearby_infrastructure": {
      "schools": [
        {
          "name": "Wellington International School",
          "notes": "Cited as closest school to Dubai Marina by Luxhabitat; exact distance not confirmed"
        }
      ],
      "healthcare": [
        {
          "name": "Emirates Hospital",
          "notes": "Cited as closest hospital by Luxhabitat; exact distance not confirmed"
        }
      ],
      "supermarkets": [
        "Waitrose (Dubai Marina Mall)",
        "Multiple supermarkets and pharmacies within the community"
      ],
      "mosques": "Mosque within the community",
      "disclaimer": "Exact distances to schools and healthcare facilities are not confirmed by sources; buyers should verify independently"
    },
    "investment_data": {
      "ownership_type": "Freehold",
      "golden_visa_eligible": true,
      "golden_visa_threshold": "AED 2,000,000 minimum purchase price",
      "average_selling_prices_dec_2025": {
        "source": "Property Monitor via Engel & Voelkers, December 2025",
        "studio": "AED 1,383,696",
        "one_bed": "AED 1,878,981",
        "two_bed": "AED 2,701,465",
        "three_bed": "AED 4,490,784",
        "four_bed": "AED 10,677,118"
      },
      "average_rental_prices_dec_2025": {
        "source": "Property Monitor via Engel & Voelkers, December 2025",
        "studio": "AED 69,154/year",
        "one_bed": "AED 96,484/year",
        "two_bed": "AED 144,521/year",
        "three_bed": "AED 219,393/year",
        "four_bed": "AED 333,700/year"
      },
      "gross_rental_yield_dld_based": {
        "source": "UAE Calc / DLD open data",
        "average_apartments": "5.1%",
        "by_type": {
          "studio": "4.5%",
          "one_bed": "5.2%",
          "two_bed": "5.5%",
          "three_bed": "5.3%",
          "four_bed_plus": "3.9%"
        }
      },
      "gross_rental_yield_market_estimates": {
        "source": "Valorisimo Q2 2025; Astraterra Q1 2026",
        "long_term_range": "5.8%–7.2% (apartments); 7.1% average per Astraterra/Property Monitor Q1 2026",
        "short_term_rental_range": "8.5%–12% gross for DTCM-licensed holiday homes",
        "note": "Short-term rental requires DTCM Holiday Home Permit. Management fees of 15–20% apply. Net yields lower than gross."
      },
      "capital_appreciation": {
        "source": "Valorisimo 2024–2025",
        "yoy_growth": "8%–12% year-on-year; luxury waterfront apartments saw ~10.4% price increase in 2024",
        "note": "Historical data; not a guarantee of future performance"
      },
      "rental_market_growth": {
        "source": "RERA Q4 2025 via Astraterra",
        "yoy_rent_growth": "+16.4% year-on-year – second highest in Dubai after Business Bay"
      },
      "transaction_volume": {
        "source": "DLD March 2026 via Astraterra",
        "note": "Dubai Marina ranked #3 by apartment transaction volume citywide in Q4 2025 with 3,200+ apartment sales"
      },
      "short_term_rental_notes": "DTCM Holiday Home Permit required. Fines from AED 5,000 for unlicensed operations. Best STR buildings include Marina Gate I & II, Cayan Tower, Princess Tower, 23 Marina."
    },
    "developer_profile": {
      "name": "LIV Real Estate Development (LIV Developers)",
      "also_known_as": [
        "LIV Developers",
        "LIV Real Estate",
        "Marina LIV Development"
      ],
      "founded": "Approximately early 2000s; Dubai operations established early 2010s",
      "ceo": "Latif Habib",
      "headquarters": "Dubai, UAE",
      "background": "Boutique luxury developer with roots in high-end real estate in Los Angeles and New York before expanding into Dubai. Focused on premium waterfront residential towers in Dubai Marina.",
      "notable_projects": [
        "LIV Residence – Dubai Marina (completed)",
        "LIV Marina – Dubai Marina (completed/near completion)",
        "LIV Lux – Dubai Marina (off-plan, est. completion Q4 2026)",
        "LIV Maritime – Madinat Dubai Al Melaheyah",
        "LIV Oceanside – Palm Deira"
      ],
      "units_delivered": "600+ high-end residential units (per Homeland.ae)",
      "built_up_area": "Exceeds 1.5 million sq ft (per Homeland.ae)",
      "reputation": "Known for glass-facade architecture, full-height glazing, resort-style amenities, and premium marina-view positioning. Strong rental demand and resale performance cited across multiple sources.",